图书名,价格,出版年,国家,作者,出版社,评分,评论数,主题评论
红楼梦,59.7,1996,清, 曹雪芹,人民文学出版社,9.6,424138,都云作者痴，谁解其中味？
活着,20.0,2012,中国,余华,作家出版社,9.4,833741,生的苦难与伟大
1984 Nineteen Eighty-Four,28.0,2010,英, 乔治·奥威尔,北京十月文艺出版社,9.4,284512,栗树荫下，我出卖你，你出卖我
哈利·波特 Harry Potter,498.0,2008,中国,J.K.罗琳 (J.K.Rowling),人民文学出版社,9.7,107256,从9¾站台开始的旅程
三体全集 : 地球往事三部曲,168.0,2012,中国,刘慈欣,重庆出版社,9.5,187652,地球往事三部曲
百年孤独 Cien años de soledad,39.5,2011,哥伦比亚, 加西亚·马尔克斯,南海出版公司,9.3,425689,魔幻现实主义文学代表作
飘 Gone with the Wind,40.0,2000,美国, 玛格丽特·米切尔,译林出版社,9.3,212521,革命时期的爱情，随风而逝
动物农场 Animal Farm,10.0,2007,英, 乔治·奥威尔,上海译文出版社,9.3,160029,太阳底下并无新事
房思琪的初恋乐园,45.0,2018,中国,林奕含,北京联合出版公司,9.2,379625,向死而生的文学绝唱
三国演义（全二册）,39.5,1998,明, 罗贯中,人民文学出版社,9.3,168535,是非成败转头空
福尔摩斯探案全集（上中下）,68.0,1981,英, 阿·柯南道尔,群众出版社,9.3,133629,名侦探的代名词
白夜行 白夜行,39.5,2013,日, 东野圭吾,南海出版公司,9.2,475208,一宗离奇命案牵出跨度近20年步步惊心的故事
小王子 Le Petit Prince,22.0,2003,法, 圣埃克苏佩里,人民文学出版社,9.1,756332,献给长成了大人的孩子们
安徒生童话故事集,25.0,1997,丹麦,安徒生,人民文学出版社,9.3,132760,为了争取未来的一代
天龙八部,96.0,1994,中国,金庸,生活·读书·新知三联书店,9.2,132979,有情皆孽，无人不冤
呐喊,0.36,1973,中国,鲁迅,人民文学出版社,9.2,160470,新文学的第一声呐喊
撒哈拉的故事,15.8,2003,中国,三毛,哈尔滨出版社,9.2,174949,游荡的自由灵魂
悉达多 : 一首印度的诗 Siddhartha,32.0,2017,德, 赫尔曼·黑塞,天津人民出版社,9.3,105157,无
邓小平时代 Deng Xiaoping and the Transformation of China,88.0,2013,美,傅高义 (Ezra.F.Vogel),生活·读书·新知三联书店,9.3,70756,个人命运背后的历史变局
杀死一只知更鸟 To Kill a Mocking Bird,32.0,2012,美, 哈珀·李,译林出版社,9.2,146830,有一种东西不能遵循从众原则，那就是——人的良心
明朝那些事儿（1-9） : 限量版,358.2,2009,中国,当年明月,中国海关出版社,9.2,174907,不拘一格的历史书写
失踪的孩子 : 那不勒斯四部曲4 Storia della bambina perduta,62.0,2018,意, 埃莱娜·费兰特,人民文学出版社,9.2,81465,我的整个生命，只是一场为了提升社会地位的低俗斗争。
新名字的故事 : 那不勒斯四部曲2 Storia del nuovo cognome,59.0,2017,意, 埃莱娜·费兰特,人民文学出版社,9.2,92062,探索青年时代的激情、困惑、挣扎、背叛和失去
野草,0.2,1973,中国,鲁迅,人民文学出版社,9.5,47437,我以这一丛野草，在明与暗，生与死，过去与未来之际，献于友与仇，人与兽，爱者与不爱者之前作证。
沉默的大多数 : 王小波杂文随笔全编,27.0,1997,中国,王小波,中国青年出版社,9.1,151490,沉默是沉默者的通行证
中国历代政治得失,12.0,2001,中国,钱穆,生活·读书·新知三联书店,9.2,72839,一部简明的“中国政治制度史”
局外人 L'Etranger,22.0,2010,法, 阿尔贝·加缪,上海译文出版社,9.1,240318,人生在世，永远也不该演戏作假
白鹿原 : 20周年精装典藏版,39.0,2012,中国,陈忠实,人民文学出版社,9.2,107960,一轴关于我们民族灵魂的现实主义画卷
乡土中国,38.0,2006,中国,费孝通,上海人民出版社,9.2,90552,中国乡土社会传统文化和社会结构理论研究代表作
卡拉马佐夫兄弟 БРАТЬЯ КАРАМАЗОВЫ,78.0,2015,俄, 费奥多尔·陀思妥耶夫斯基,上海译文出版社,9.6,34178,无
人类简史 : 从动物到上帝 Sapiens: A brief history of humankind,68.0,2014,以色列, 尤瓦尔·赫拉利,中信出版社,9.1,199711,跟着人类一同走过十万年
围城,19.0,1991,中国,钱锺书,人民文学出版社,9.0,447229,幽默的语言和对生活深刻的观察
平凡的世界（全三部）,64.0,2005,中国,路遥,人民文学出版社,9.0,324416,中国当代城乡生活全景
彷徨,0.37,1973,中国,鲁迅,人民文学出版社,9.3,65610,路漫漫其修远兮，吾将上下而求索
罗杰疑案 : 阿加莎·克里斯蒂作品02 The Murder of Roger Ackroyd,28.0,2013,英, 阿加莎·克里斯蒂,新星出版社,9.2,74632,无
许三观卖血记,24.0,2012,中国,余华,作家出版社,9.2,163852,无
笑傲江湖（全四册）,76.8,1994,中国,金庸,生活·读书·新知三联书店,9.1,111846,欲练此功，必先自宫
我与地坛 : 史铁生代表作,25.0,2002,中国,史铁生,春风文艺出版社,9.2,108837,这是你的罪孽与福祉
献给阿尔吉侬的花束 Flowers for Algernon,36.0,2015,美, 丹尼尔·凯斯,广西师范大学出版社,9.1,108964,当声称能改造智能的科学实验选中心智障碍主角
东方快车谋杀案 Murder on the Orient Express,18.0,2006,英, 阿加莎·克里斯蒂,人民文学出版社,9.1,139706,谋杀诡计惊人，波洛的抉择耐人寻味
肖申克的救赎 Different Seasons,29.9,2006,美, 斯蒂芬·金,人民文学出版社,9.1,121564,豆瓣电影Top1原著
江城 River Town,36.0,2012,美, 彼得·海斯勒,上海译文出版社,9.1,62958,外国人眼中的涪陵
基督山伯爵 Le Comte de Monte-Cristo,43.9,1991,法国, 大仲马,上海译文出版社,9.1,129488,一个报恩复仇的故事，以法国波旁王朝和七月王朝为背景
霍乱时期的爱情 El amor en los tiempos del cólera,39.5,2012,哥伦比亚, 加西亚·马尔克斯,南海出版公司,9.0,285907,义无反顾地直达爱情的核心
城南旧事 : 纪念普及版,16.0,2003,中国,林海音 文,中国青年出版社,9.1,157312,长亭外，古道边，芳草碧连天
故事新编,0.31,1973,中国,鲁迅,人民文学出版社,9.4,43359,拾取古代传说，取一点因由，随意点染
艺术的故事 The Story of Art,280.0,2008,英, 贡布里希 (Sir E.H.Gombrich),广西美术出版社,9.6,26366,从最早的洞窟绘画到当今的实验艺术
万历十五年,18.0,1997,美, 黄仁宇,生活·读书·新知三联书店,9.0,202116,见微知著，历史观的颠覆
朝花夕拾,0.25,1973,中国,鲁迅,人民文学出版社,9.1,155088,在纷扰中寻出一点闲静
月亮和六便士 The Moon and Sixpence,15.0,2006,英, 毛姆,上海译文出版社,9.0,209675,有多少人会经历顿悟，就有更少的人甘愿自我放逐
厌女 : 日本的女性嫌恶 女ぎらい,28.0,2015,中国,上野千鹤子,上海三联书店,9.1,81917,无
秋园,38.0,2020,中国,杨本芬,北京联合出版公司,9.0,108161,无
射雕英雄传,47.0,1999,中国,金庸,生活·读书·新知三联书店,9.1,85758,侠之大者，为国为民
置身事内 : 中国政府与经济发展,65.0,2021,中国,兰小欢,上海人民出版社,9.1,80000,无
追风筝的人 The Kite Runner,29.0,2006,美, 卡勒德·胡赛尼,上海人民出版社,8.9,794995,为你，千千万万遍
刀锋 The Razor's Edge,18.0,2007,英,毛姆,上海译文出版社,9.0,91960,一把刀的锋刃不容易越过；因此智者说得救之道是困难的
寻路中国 : 从乡村到工厂的自驾之旅 Country Driving: A Journey Through China from Farm to Factory,33.0,2011,美, 彼得·海斯勒,上海译文出版社,9.0,56951,《纽约客》驻北京记者驾车漫游中国大陆的经历
树上的男爵 Il barone rampante,30.0,2012,意大利,伊塔洛·卡尔维诺,译林出版社,9.1,60384,是不是真的只有先与人疏离，才能最终与他们在一起？
无人生还 And Then There Were None,19.0,2008,英, 阿加莎・克里斯蒂,人民文学出版社,9.0,150317,童谣杀人案
格林童话全集 Kinder-und Hausmärchen,21.45,1994,德国,格林兄弟,人民文学出版社,9.0,95593,一本有教育意义的书
中国少年儿童百科全书（全四册）,168.0,1991,中国,林崇德 主编,浙江教育出版社,9.4,18679,无
鼠疫 La Peste,34.0,2013,法, 阿尔贝·加缪,上海译文出版社,9.1,79337,用别样的监禁生活再现某种监禁生活，与用不存在的事表现真事同等合理
嫌疑人X的献身 容疑者Xの献身,28.0,2008,日, 东野圭吾,南海出版公司,8.9,524259,数学好是一种极致的浪漫
西游记（全二册）,47.2,2004,中国,吴承恩,人民文学出版社,9.1,88960,神魔皆有人情，精魅亦通世故
黄金时代 : 时代三部曲,19.0,1999,中国,王小波,花城出版社,8.9,166810,我想爱，想吃，还想在一瞬间变成天上半明半暗的云
可能性的艺术 : 比较政治学30讲,82.0,2022,中国,刘瑜,广西师范大学出版社,9.2,40863,无
史记（全十册） : （全十册）,125.0,1982,中国,司马迁,中华书局,9.5,24956,史家之绝唱，无韵之离骚
傲慢与偏见 Pride and Prejudice,13.0,1993,英, 奥斯丁,人民文学出版社,8.9,233310,所有现代言情小说的母体
始于极限 : 女性主义往复书简 往復書簡 限界から始まる,59,2022,日, 上野千鹤子,新星出版社,9.0,71403,无
悲惨世界（上中下） Les Misérables,66.0,1992,法, 雨果,人民文学出版社,9.1,63894,现实主义与浪漫主义的至高杰作
台北人,38.0,2010,中国,白先勇,广西师范大学出版社,9.0,73763,白先勇短篇小说集
诗经,19.9,2006,中国,孔丘 编订,北京出版社,9.5,28820,思无邪
永恒的终结 : 关于时间旅行的终极奥秘和恢宏构想 The End of Eternity,32.0,2014,美, 艾萨克·阿西莫夫,江苏凤凰文艺出版社,9.1,47412,关于时间旅行的终极奥秘和恢宏构想
孽子,46.0,2010,中国,白先勇,广西师范大学出版社,9.2,47650,写给那一群， 在最深最深的黑夜里， 独自彷徨街头， 无所依归的孩子们
刘擎西方现代思想讲义,79.0,2021,中国,刘擎,新星出版社,9.2,36472,无
历史深处的忧虑 : 近距离看美国之一,19.0,1997,中国,林达,生活·读书·新知三联书店,9.0,45903,窥见美国社会的一扇窗
太白金星有点烦,45.0,2023,中国,马伯庸,湖南文艺出版社,9.0,85501,无
神雕侠侣 神鵰俠侶,76.8,1996,中国,金庸,生活·读书·新知三联书店,8.9,101297,至情至性，情大于武
上帝掷骰子吗 : 量子物理史话,32.0,2006,中国,曹天元,辽宁教育出版社,9.2,34823,量子物理史话
"美丽新世界 BRAVE NEW WORLD, BRAVE NEW WORLD REVISITED",45.0,2017,英,奥尔德斯·赫胥黎,上海译文出版社,9.2,57032,无
一个叫欧维的男人决定去死 En man som heter Ove,35.0,2015,瑞典, 弗雷德里克·巴克曼,四川文艺出版社,9.1,68697,这个发生在瑞典的故事，如生命庆典般绚丽斑斓
哭泣的骆驼,15.8,2003,中国,三毛,哈尔滨出版社,9.0,57559,沙漠中寻常的生与死
唐诗三百首,0.65,1984,中国,蘅塘退士,中华书局,9.4,27184,熟读唐诗三百首，不会吟诗也会吟
四世同堂,36.0,2008,中国,老舍,北京十月文艺出版社,9.4,40170,北平沦陷时代广大平民的悲惨遭遇
灿烂千阳 A Thousand Splendid Suns,28.0,2007,美, 卡勒德·胡赛尼,上海人民出版社,8.9,122596,唯有希望与爱可以驱散阴霾
美的历程,43.0,2009,中国,李泽厚,生活·读书·新知三联书店,9.2,32289,中国美学经典之作
文学回忆录 : 1989—1994,98.0,2013,中国,木心 口述,广西师范大学出版社,9.1,44499,木心留给世界的礼物
窗边的小豆豆 窓ぎわのトットちゃん,20.0,2003,日, 黑柳彻子,南海出版公司,8.8,211787,真正懂孩子的教育经
最好的告别 : 关于衰老与死亡，你必须知道的常识 Being Mortal: Medicine and What Matters in the End,54.9,2015,美, 阿图·葛文德(Atul Gawande),浙江人民出版社,9.0,51007,关于衰老与死亡，你必须知道的常识
人间词话,9.8,1998,中国,王国维,上海古籍出版社,9.0,55336,以新眼光评旧文学
绝叫 絕叫,58.0,2020,日, 叶真中显,北京联合出版公司,8.9,103988,无
呼兰河传 : 1947年版本・原版珍藏,19.0,2005,中国,萧红,百花文艺出版社,9.0,84198,萧红的童年往事
罪与罚 Преступление и наказание,23.0,2006,俄, 陀思妥耶夫斯基,上海译文出版社,9.3,35576,描绘人内心的全部深度
冬牧场,29.8,2012,中国,李娟,新星出版社,9.0,39612,阿勒泰的精灵
道德经,4.5,1996,中国,黄元吉,陕西人民出版社,9.5,20507,中国历史上首部完整的哲学著作
看见,39.8,2013,中国,柴静,广西师范大学出版社,8.8,338093,在这里看见中国
棋王·树王·孩子王 : 阿城文集 之一,58.0,2016,中国,阿城,江苏凤凰文艺出版社,9.2,28682,无
也许你该找个人聊聊 Maybe You Should Talk to Someone,68.0,2021,美,洛莉·戈特利布,上海文化出版社,9.0,49588,无
浪潮之巅,55.0,2011,中国,吴军,电子工业出版社,9.0,33700,了解IT领域的入门读物
离开的，留下的 : 那不勒斯四部曲3 Storia di chi fugge e di chi resta,62.0,2017,意, 埃莱娜·费兰特,人民文学出版社,8.9,75158,探索中年的虚无、困惑、野心和近乎残暴的爱
毛泽东选集 第一卷,40.0,1991,中国,毛泽东,人民出版社,9.6,28772,无
爱你就像爱生命,18.0,2008,中国,王小波,上海锦绣文章出版社,8.8,115381,王小波与李银河的两地书
叫魂 : 1768年中国妖术大恐慌 Soulstealers: The Chinese Sorcery Scare of 1768,38.0,2014,美, 孔飞力,生活·读书·新知三联书店 上海三联书店,9.2,29523,无
失明症漫记 Ensaio sobre a Cegueira,29.5,2014,葡, 若泽·萨拉马戈,南海出版公司,9.1,38506,失明症迅速蔓延，整个城市陷入一场空前的灾难
人生的枷锁 Of Human Bondage,32.0,2007,英, 毛姆,上海译文出版社,9.1,31096,在混沌纷扰的生活漩流中，寻求人生的真谛
我们仨,18.8,2003,中国,杨绛,生活·读书·新知三联书店,8.8,310261,家庭生活回忆录
桶川跟踪狂杀人事件 桶川ストーカー殺人事件,45.0,2021,日, 清水洁,四川人民出版社,9.0,48431,无
看不见的城市 Le città invisibili,25.0,2012,意, 伊塔洛·卡尔维诺,译林出版社,9.0,37392,无
受戒 : 汪曾祺自选集,3.95,1987,中国,汪曾祺,漓江出版社,9.4,26972,江南乡镇民间生活，健康淳朴的人性
巨人的陨落 : 世纪三部曲 Fall of Giants,129.8,2016,英, 肯·福莱特,江苏凤凰文艺出版社,8.9,85315,五个家族，一场战争
海子的诗,15.4,1999,中国,海子,人民文学出版社,9.0,46530,无
教父 The Godfather,23.3,1997,美,马里奥·普佐,译林出版社,9.0,40572,“教父三部曲”电影原著
人生的智慧,28.0,2008,德,叔本华,上海人民出版社,9.2,32824,对世俗、实用问题深刻而透彻的讨论
飞鸟集,16.8,2004,印, 罗宾德拉纳德·泰戈尔,哈尔滨出版社,8.9,66336,一个淡泊清透的世界
少年凯歌,10.0,2001,中国,人民文学出版社,人民文学出版社,9.3,18191,无
遥远的向日葵地,38.0,2017,中国,李娟,花城出版社,9.1,33280,无
鹿鼎记,108.0,2008,中国,金庸,广州出版社 花城出版社,8.9,55893,武侠的解构，流氓的狂欢
斯通纳 Stoner,49.0,2016,美, 约翰·威廉斯,上海人民出版社,8.8,64667,即使不能拥有完美的生活，所幸追求过完整的自我
茶馆,9.8,2002,中国,老舍,人民文学出版社,9.2,33752,清末、民初、抗战胜利以后三个历史时期的北京生活风貌
克莱因壶 クラインの壷,48.0,2019,日, 冈岛二人,化学工业出版社,8.9,67277,无
一间只属于自己的房间 A Room of One's Own,45.0,2019,英, 弗吉尼亚·伍尔夫,天津人民出版社,9.2,27058,无
陆犯焉识,35.0,2011,中国,严歌苓,作家出版社,8.9,57663,翻手为苍凉，覆手为繁华
边城,12.0,2002,中国,沈从文,北岳文艺出版社,8.7,230489,一切充满了善，然而到处是不凑巧
人间草木,20.0,2005,中国,汪曾祺,江苏文艺出版社,9.2,32469,我就是要这样香，香得痛痛快快
梦里花落知多少,28.0,2007,中国,三毛,北京十月文艺出版社,8.8,97936,哀而不伤
十万个为什么,30.0,1962,中国,少年儿童出版社,少年儿童出版社,9.2,19880,无
额尔古纳河右岸,32.0,2019,中国,迟子建,人民文学出版社,9.1,45125,无
西线无战事 Im Westen nichts Neues,49,2021,德, 埃里希·玛丽亚·雷马克,上海文艺出版社,9.4,20192,无
时间简史 : 插图本 A Brief History of Time,45.0,2010,英, 史蒂芬·霍金,湖南科学技术出版社,8.9,62528,探索时间和空间的核心秘密
筚路维艰 : 中国社会主义路径的五次选择,45.0,2014,中国,萧冬连,社会科学文献出版社,9.5,15184,无
金色梦乡 ゴールデンスランバー,35.0,2010,日, 伊坂幸太郎,译林出版社,9.0,30673,伊坂幸太郎代表作
王尔德童话 The tales of Oscar Wilde,6.0,2003,英, 王尔德,译林出版社,9.1,24083,一颗纯美纯善、永难泯灭的童心
面纱 The Painted Veil,39.8,2016,英, 威廉·萨默塞特·毛姆,江西人民出版社,9.0,39686,无
小径分岔的花园 El jardín de senderos que se bifurcan,23.0,2015,阿根廷, 豪·路·博尔赫斯,上海译文出版社,8.9,46840,一个谜语，谜底正是时间
这些人，那些事,28.0,2011,中国,吴念真,译林出版社,8.8,67382,平淡叙述下的惊心动魄
13 67 : 陳浩基作品2,350,2014,中国,陳浩基,皇冠文化出版有限公司,9.1,21824,无
昨日的世界 : 一个欧洲人的回忆 Die Welt von Gestern: Erinnerungen eines Europäers,32.0,2004,奥, 斯蒂芬·茨威格,广西师范大学出版社,9.3,14693,一个高贵而残破的昨日镜像
流俗地,55.0,2021,马来西亚,黎紫书,北京十月文艺出版社,9.2,20101,无
平面国 : 多维空间传奇往事 Flatland: A Romance of Many Dimensions,39.8,2020,英, 埃德温·A.艾勃特,上海文化出版社,9.2,20926,无
绿毛水怪,30.0,2009,中国,王小波,时代文艺出版社,9.1,25145,我们好象在池塘的水底，从一个月亮走向另一个月亮
2001：太空漫游 : 《太空漫游四部曲》第1部 2001: A Space Odyssey,62.0,2019,英, 阿瑟·克拉克,上海文艺出版社,9.3,22117,无
南京大屠杀 : 第二次世界大战中被遗忘的大浩劫,49.0,2015,美,张纯如(Iris Chang),中信出版社,9.7,18378,无
你当像鸟飞往你的山 Educated: A Memoir,59.0,2019,中国,塔拉·韦斯特弗,南海出版公司,8.7,189193,我来自一个极少有人能想象的家庭，教育给了我新世界
我的天才女友 : 那不勒斯四部曲1 L'amica geniale,42.0,2017,意, 埃莱娜·费兰特,人民文学出版社,8.7,114673,“那不勒斯四部曲”第一部，两个女人，50年的友谊和战争
长日将尽 The Remains of the Day,48,2018,英, 石黑一雄,上海译文出版社,8.9,37127,无
故事 : 材质·结构·风格和银幕剧作的原理 Story,68.0,2014,美, 罗伯特·麦基,天津人民出版社,9.2,19491,材质、结构、风格和银幕剧作的原理
经济学原理（上下）,88.0,2003,美, 曼昆,机械工业出版社,9.1,22279,经济学家们的世界观
一句顶一万句,29.8,2009,中国,刘震云,长江文艺出版社,8.8,83159,一句胜过千年
海的女儿,0.43,1978,中国,安徒生,上海译文出版社,9.1,24375,无
國史大綱（上下）,76.0,2013,中国,錢穆,商务印书馆,9.4,16367,钱穆中国通史
阿勒泰的角落,25.0,2010,中国,李娟,万卷出版公司,9.1,21465,白雪和阳光，青草和白桦林
强风吹拂 風が強く吹いている,39.0,2015,中国,三浦紫苑,广西师范大学出版社,9.0,27797,明明这么痛苦，这么难过，为什么就是不能放弃跑步？
鹿川有许多粪 녹천에는 똥이 많다,58.0,2021,中国,李沧东,武汉大学出版社,8.9,33582,无
地下室手记 Записки из подполья,39.8,2020,俄罗斯, 陀思妥耶夫斯基,浙江文艺出版社,9.3,23966,无
檀香刑,56.0,2017,中国,莫言,浙江文艺出版社,9.3,31280,无
德米安 : 埃米尔·辛克莱的彷徨少年时 Demian: die geschichte von emil sinclairs jugend,25.0,2009,德, 赫尔曼·黑塞,上海人民出版社,8.9,38060,少年辛克莱寻找通向自身之路的艰辛历程
安娜·卡列尼娜 Anna karenina,37.0,2007,俄, 列夫·托尔斯泰,上海文艺出版社,9.2,29738,无
一个陌生女人的来信 Brief einer Unbekannten,20.0,2007,奥, 斯蒂芬·茨威格,上海译文出版社,8.7,146825,暗恋的极致
万水千山走遍,13.8,2003,中国,三毛,哈尔滨出版社,8.9,46239,从遥远的撒哈拉到敦煌戈壁
苏菲的世界 Sofies verden,26.0,2007,挪, 乔斯坦·贾德,作家出版社,8.8,58802,哲学启蒙书
全球通史(上) : 从史前史到21世纪,42.0,2006,美,斯塔夫里阿诺斯,北京大学出版社,9.2,19041,无
翦商 : 殷周之变与华夏新生,99.0,2022,中国,李硕,广西师范大学出版社,9.0,27840,无
史蒂夫·乔布斯传 Steve Jobs: A Biography,68.0,2011,美, 沃尔特·艾萨克森,中信出版社,8.8,61209,完美主义者的最高形态
不能承受的生命之轻 : 中文全译本百万纪念版,29.0,2010,中国,米兰·昆德拉,上海译文出版社,8.8,47252,无
温柔的夜,28.0,2007,中国,三毛,北京十月文艺出版社,9.1,23750,三毛在加纳利群岛的生活
球状闪电,22.0,2005,中国,刘慈欣,四川科学技术出版社,8.7,88653,量子之外，没有真相
爱的艺术,15.0,2008,美, 艾·弗洛姆,上海译文出版社,8.8,49850,谦恭地、勇敢地、真诚地和有纪律地爱他人
草房子,18.0,2009,中国,曹文轩,江苏少年儿童出版社,9.0,53590,男孩桑桑刻骨铭心、终身难忘的六年小学生活
我不知道该说什么，关于死亡还是爱情 : 来自切尔诺贝利的声音 Voices from Chernobyl,34.8,2014,白俄, S·A·阿列克谢耶维奇,花城出版社,9.1,20243,真实记录切尔诺贝利核灾难事件
亮剑,28.0,2005,中国,都梁,解放军文艺出版社,9.0,31156,面对强大的对手，明知不敌，也要毅然亮剑
半生缘 : 张爱玲全集04——小说,29.6,2012,中国,张爱玲,北京十月文艺出版社,9.1,31843,无
霸王别姬,10.2,1999,中国,李碧华,人民文学出版社,9.1,22524,人间，只是抹去了脂粉的脸
恶意 悪意,39.5,2016,日, 东野圭吾,南海出版公司,8.7,130112,无
古文观止,21.0,1987,中国,吴楚材,中华书局,9.1,19175,收录自先秦至明末的散文二百二十二篇
我的阿勒泰 My Altay,22.0,2010,中国,李娟,云南人民出版社,8.9,28748,描写疆北阿勒泰地区生活和风情的原生态散文集
冰与火之歌 : （1-5卷：权力的游戏、列王的纷争、冰雨的风暴、群鸦的盛宴、魔龙的狂 A Song of Ice and Fire,330.0,2013,美,乔治·R.R.马丁,重庆出版社,9.5,18818,乔治·R·R·马丁史诗奇幻小说
生死疲劳,69.9,2022,中国,莫言,浙江文艺出版社,9.1,39945,无
我也有一个梦想 : 近距离看美国之三,25.0,2004,中国,林达,生活·读书·新知三联书店,9.0,16095,在法治国家里，民众怎样运用法律
麦琪的礼物 : 欧·亨利短篇小说经典,25.0,2003,美, 欧·亨利,上海社会科学院出版社,8.7,75956,日常的奇迹
倾城之恋 : 张爱玲全集01——小说,29.8,2012,中国,张爱玲,北京十月文艺出版社,8.9,40154,无
激荡三十年（上） : 中国企业1978-2008,35.0,2007,中国,吴晓波,中信出版社 浙江人民出版社,8.8,32172,这是一个最好的时代，也是一个最坏的时代
社会心理学 : （第8版）,68.0,2006,美, 戴维·迈尔斯,人民邮电出版社,9.0,27129,人们是如何思索、影响他人并与他人建立联系的
天朝的崩溃 : 鸦片战争再研究,32.0,2005,中国,茅海建,生活·读书·新知三联书店,9.2,15196,鸦片战争再研究
海风中失落的血色馈赠 The Lost Salt Gift of Blood,20.0,2015,加拿大, 阿利斯泰尔·麦克劳德,上海文艺出版社,9.0,20829,男女之间、父母与子女之间紧密的纽带和难以逾越的鸿沟
亲密关系 Intimate Relationship,138.0,2015,美,罗兰·米勒 (Rowland S. Miller),人民邮电出版社,9.3,26228,无
天生有罪 : 特雷弗·诺亚的变色人生 Born a Crime: Stories from a South African Childhood,58.0,2018,南非, 特雷弗·诺亚,北京联合出版公司,9.0,20677,无
雕刻时光 ЗАПЕЧАТЛЕННОЕ ВРЕМЯ,45.0,2016,苏, 安德烈·塔可夫斯基,南海出版公司,9.5,9270,无
一桩事先张扬的凶杀案 Crónica de una muerte anunciada,25.0,2013,哥伦比亚, 加西亚·马尔克斯,南海出版公司,8.7,52059,我如此急切地想要讲述这桩案件，也许是它最终确定了我的作家生涯
东晋门阀政治,49.0,2012,中国,田余庆,北京大学出版社,9.5,13174,无
情书 ラヴレター,18.0,2004,日, 岩井俊二,天津人民出版社,8.6,107479,一场同名同姓的误会，两段可贵的爱情
从零开始的女性主义 上野先生、フェミニズムについてゼロから教えてください！,52.0,2021,日本, 上野千鹤子,北京联合出版公司,8.7,67719,无
万物有灵且美 All Things Bright and Beautiful,28.8,2010,英, 吉米·哈利,中国城市出版社,8.9,23235,活泼的生命完全无须借助魔法，便能对我们述说至美至真的故事
李光耀观天下 李光耀观天下,58.0,2015,中国,李光耀,北京大学出版社,9.2,13690,无
罗生门 羅生門,12.0,2008,日, 芥川龙之介,上海译文出版社,8.7,70724,人生，远比地狱更像地狱
浮生六记,38,1999,清,沈复,人民文学出版社,8.7,71035,苟不记之笔墨，未免有辜彼苍之厚
荒原狼,13.0,2008,德,赫尔曼·黑塞,上海译文出版社,9.0,23517,“超现实主义”风格作品，德国的《尤利西斯》
尼罗河上的惨案 Death on the Nile,22.0,2006,英, 阿加莎·克里斯蒂,人民文学出版社,8.7,50086,阿加莎·克里斯蒂代表作
